title,score,body,id
My shitty problems,7,"I'm every day frustrated because i feel like no one cares about me. I see people in social media having fun with their friends and couples and I envy them a lot.

I fantasize a lot of having a boyfriend and how cute is that, but then i realize I will never have one.

I just want someone to love me but that's imposible because of how i am.

I know this is a shitty problem and that there are people more fucked up than me, but I'm stupid and I care about meaningless things.",fqa5n9
Calendar Phone Scams,2,Can anyone tell me how I get rid off these scams on my calendar it’s pissing me off now and I’m tired of it it says Click Subscribe,fq7vwg
"My stepmother and my dad just had a disagreement, what can I do?",2,"So, I was playing my Nintendo Switch, my dad was trying to install the new washing machine for the dishes and then my stepmother started shouting and then my dad started as well, because, that disagreement just started now and I just can't take it more!!!",fq2tye
"I am out of Vodka, Is it okay to use the mouthwash instead?",5,Joke answers appreciated. But can I? Would like to know.,fpm0oc
"I like this guy, but i don’t know if he likes me😅",3,"We play a lot of video games together and just talk a lot, but sometimes he just doesn't answer me. In the beginning, when it's just us who play we talk while we play, but when we play with some of our friends it just seems like he doesn't wanna talk to me. Idk what to do 😅😖.",fowwo2
Should i choose science or love?,1,"So I want to study astrophysics and spend my life on science but in the same time, I'm feeling some kind a love to one girl I know, but I'm afraid of choosing. One of my friends says that I should leave love behind if I want to deal with science, but I don't want to leave either love nor science, at this very moment I'm just not sure what to do... Should I sacrifice my life for science and knowledge or someone I love?",fowrij
i know I'm an idiot but it worked,3,I punched the shit out my modem,fot76l
Youngest sister is a liar,2," 

My youngest sister lies to me all the time. i wonder what her motive is. I am the eldest of three. My youngest sister never lies to my younger sister but she always lies to me. Does she hate me or is she just trying to get attention? What possibly are other reasons why she is like that?",fokkpm
What should i do? What should i feel?,1,"My question is below the backstory 

Backstory : I have been in many different relationships. I had girlfriends and i had boyfriends, yet i have never been as happy as with this one person. I met him few months ago and we instantly fell in love with each other. We saw it in each others' eyes. It was that shine and that emotion no words could have explained. Then came our relationship. We started off really quickly. We were very atracted to each other and we shared many emotions. We felt comfortable together. So comfortable that he was the first person i ever fully opened sexually to.
After few months of heaven i started to notice that he wasn't feeling as good as i did. We talked many nights and settled that he is afraid of geting into a serious relationship. 
I agreed on not calling it a relationship then, and not calling each others boyfriends. Next few weeks passed calmly but then the tough times came... Coronavirus has appeared and we got seperated by 350 miles. It wasn't the distance that concerned me.
The day he arrived home we talked on the phone, he sounded much happier than with me.
I asked him what he felt like - he said he felt free. 
He was feeling bad with commitment and got scared because of me stepping into his daily life.
Tonight we broke up.

I really love him. He loves me too.

I can't be in opened relationship which is his proposition. I am a romantic, emotional and delicate guy.

I don't know what to do or what to feel like. I would love to try being in this relation with him, because i am afraid of loosing him and yet again being alone. At the same time i am scared of being hurt because of this kind of relation.

Please... Help me",foizri
"Help, my left ear is clogged up!!!",1,"So this week, I woke up and I felt something clogged in my ear while I was asleep last night, so I tried cleaning out my ears with the q-tip, pinching my nose and breathe through my mouth shut, but it didn't work, so I had to ask my dad for some ear relief drops after dinner, but he was too busy...",fogtfv
My teacher hates me,4,"I’ve never been a great student in my life , recently , my teacher ( geography) found out that I have been day dreaming In class a lot. So she asked me a question one day and I couldn’t answer, which somehow lead her to discover that I have been drawing on a notebook instead of listening.( I know that it’s my fault) she started just hating me , whenever I would present a answer and it’s right she would be all like I didn’t do it and copied it ( when I actually did it) .

And last week, we got back a practice test thingy ( that I failed)  and she said :” I’m really happy from the results that some people didn’t pass , since some people clearly don’t deserve to pass ” which clearly, that someone is me. I know I’m at fault here but I juts really hate geography and I don’t plan to take it anymore. Is there a way to make the teacher likes me or just straight out annoy the teacher since she isn’t that great of a teacher anyway?",fnhxhg
Covid-19 and smoking weed on probation,2,"So I recently graduated my outpatient program where I took Drug test for my p.o 
As well as got my ged, but now that it’s over I’ve smoked a total of 3 bowls over the span of 5 days and my court date is on April 29th, I asked if she would be calling me in for meeting or something and she said she could come see me but the office is closed for the corona virus so I went ahead and smoked, I was clean for months before and I only smoked like two small nugs or three small bowls, I doubt she’ll call me in for a drug test cause of the virus and us being locked down starting tomorrow and if she did I’d say I have pneumonia or something. Btw I’m 6’0 tall and around 200lbs(mostly fat tbh) 

You think I’ll be fine or should I be pulling my hair out rn. Also I know it’s dumb to smoke on probation but that doesn’t do me any good right now",fngotd
A considerably intimate problem so please dont find this funny.,3,"Hey guys. Im M16. This is my first time in this community. I have a question or more possibly a problem. Ten minutes ago I just took a great warm shower. Then I went to urinate and got quite scared for a second as my urine was neither yellow or transparent, it was cloudy. I probably wouldnt notice this at first if the tip of my penis didnt burn a bit. I dont genuinly talk about it but as I dont know what this is I am typing here with a hope of getting a response that might tell me what is going on with my penis. I thought that it might have been a bit of soap getting into my penis while I was taking a shower, but as I said, I am not sure, so please, any help will be greatly appreciated. <3

Thank you in advance",fm2uf9
Amercans,1,What do you have on a Hotdog? I'm needing new ideas,flx1uz
It bothers me again and again.,1,"Hi. I need advice what should I do if I don't want to congratulate my dad on his birthday. It's not only about my father, it's about everyone, I don't want to do this to anybody. In our culture we gotta say ""warm words"" of congratulations, wish something like money, health, happiness, etc. He is going to be 50 but I just don't want to do so, I don't feel like I have something to say sincerely. What should I do? I'm tired of fake congratulations.

To add, I don't feel any connection to people, maybe that's why I don't care and don't want to congratulate. It sucks as hell.

It's also about saying ""thank you"", expressing gratitude at all, having friends (I don't have any) (and it's probably NOT OK). Something definitely wrong with me.",flvmg1
My HS crush is now an Egirl...,1,Not sure how to feel about it honestly. I spent the $10 and I can't complain but half of me is like wtf? And the other half is like aye that's some good shit.,fljyy4
I'm born in march.,4,"This is worst year for the guys who were born in March and April as well.
My whole country went insane, everyone panic, buying the toilet paper(i dunno why everyone has diarrhea,but ok)
Anyway the main thing that i hate that i cannot see my mom, because i live in another town. I can go there but i will be in quarantine zone even if I have good health.
 Ah, i forgot to write that I'm from Kazakhstan, also i hate my politics and now i hate them even more. I love my parents and my family. I hope everyone will be okay after this horrible thing stops. I'm with you brothers and sisters just know it.",flgs2c
I am sick of this shit,3,"My mom and I since I gone to High school we are arguing for stupid reasons. I'll tell you sth that really hurt my heart last night. So my mom was suggesting me to go for a ride with her car. Because I am very scared of Corona virus I politely refused. Then I got shocked. She threatened to punch me and she called me a loser. When she left I burst into tears. Thank god my grandparents were on my side. I was a lot better afterwards. 

The question is how can I respond if this happens many times?",fkxppb
My friend freaks out about the coronavirus😫,3,"It basically took over our everyday convo. I cannot change the subject with her , I can try to talk about Netflix , no I'm being too irresponsible and she switches to virus. 

I share my news about my university plans , she says "" if I were you I wouldn't have my hopes up in case they don't open borders and you stuck here "" for context; I got the call from uni and they really wanted to meet me and asked if I'm interested. I liked their course and how close it is so I applied for uni abroad which is like 2 hours by car ( yes I live close to border ) and it just sucks to hear that she just shoots down a thing that made me happy and hopeful. 


I tried to talk to her, calm her down but she dosent listen. She watched so many news and is terrified she locked herself in her house and sends her parents to do her shopping ( she is 22 ). I told her she should take necessary precautions but not to panic cause it won't do shit but everytime I share my opinion she just says I am not careful enough. 
It drives me nuts. Any advice? I asked her if she has some issues with me moving abroad even if it is still 2 hours by car from her. She has driving license but is too scared to drive. 


Sorry for the rant but I need an opinion from someone. 
Thank you and have a nice day/evening 🌺",fjup7n
Well imma head out,2,"Gonna take a break from reddit ever since I started I’ve been going down hill physically, mentally, socially, in terms of school work. Haven’t even been using it nearly as much as YouTube. But at my old school I could work like crazy all day i was a complete workaholic. At this new school the low IQ spreads everywhere and now i can’t do anything. Probably the fact that my family is now falling apart isn’t helping. And this corona virus stuff about schools maybe closing and taking time from summer and all of my previous friends that are so epic but I can’t keep up and keep doing stuff with them because 1 i for some Reason feel like it’s really hard work having like more than 3 friends at once I just don’t get why it should be fine they are all amazing,it’s just my families apartment is tiny so I always go to theirs which doesn’t help cuz then that limits a lot. I just don’t know anymore. I want to work nonstop but I can’t with all these changes and stress. Somehow I’m not depressed but I do feel like I’m getting anxiety more,m now. Anyways, Hope I didn’t annoy someone somehow or make someone lose loads of their time reading this I doubt anyone will but I hope it’s going well. Cya in a couple months",fjta54
I've tried talking to my best friend and she didn't answer me... What can I do?,5,So when I text my friend on messenger and she didn't talk to me and I was so lonely,fjqarl
My brother hates me like everyone else,4,"I was born  in 2002, I was never good at school getting 6 and f's, but it never bothered me, it bothered my brother, every thing I do wrong ""YOU FUCKTARD"" ""YOU GODDAMN FAILURE"" he would also beat me up to joke about it, and I could not do anything, I just have to go with it expecting him to change even though we all know it will never happend, one time I locked my self up in my mom's room ( I used to do it very often as a kid) and he broke the fucking door causing it to fall on the bed and that day I got a scar on my chest for ever to be there, the only time I escape is when I sleep, in 2015-2016 I had suicidal thoughts everywhere, I didn't even care about my ego, but i found this guy called PolarSaurusRex and his jokes make me happier every day,
I also never got help from my friends coz they would just laugh,of course I'm 18 and I moved away like 5 months ago, 
My jokes are also really bad, when I get a bit nervous I turn really toxic and fucking annihilate everybody who talks to me,
""Hey kid can you-"" ""BOY ILL RIP YOU'RE FUCKING GUTS OUT OF YOU IF YOU KEEP TALKING TO ME FUCKING RAT ASS WITH SHIT ON HEAD""
I just wanted to get this off my chest cause I couldn't keep it in any longer, you can fucking scream in my ear of how much of a loser I am, i dont care really.",fj9bfw
I lost all of my friends on discord for sharing my opinion and I'm afraid that they will spread false things on the internet,5,"I just told them that I don't find anime interesting and now they unfriended me and made edits of me saying ""I like dicks"" or ""I star in a gay porn"" and I fear they post it without me knowing. What do I do?",fisfxc
I dont know what to do,4,"My dad is a single parent taking care of me. He has a very short temper and stays mad for a very long time. Sometimes he says that i'm too much to take care of and that he will send me off somewhere. I'm too scared to leave him since my dad is the only parent that I have, but sometimes I think it's for the better if I leave him since he isnt a good parent. I feel confused and I don't know what to do",fhly2g
I can't get my best friend to text me back... What can I do?,2,Yesterday this morning I was texting my friend on messenger and she did not answer me back at all and I was feeling sad and very unhappy,fhapgl
Monitor Problems,1,After about 20 min of me being on my monitor everything starts to get outlined with green pixels and it slowly gets worse and worse the longer im on my computer. Does anyone know whats wrong or how I fix this?,fh49yk
"Help, I just sat next to a person that has a panic attack on the airplane!!!",2,"So I got on the airplane, I sat next to the person and it was a woman and she got very scared and she felt very uncomfortable... so the workers for the airline and I had to have a discussion about what happened, so they told me to take a deep breath and then they told me don't sit next to her. So after having a talk with my dad, he told me I am good, because, sometimes people have issues.",fh3kb7
"Help, I heard a guy yelling through a microphone!!!",3,While sitting and reading my book on the bunch and some guy in that ford mustang yelled out some words with a microphone and it scared me in a very deep shock and I was about to cry when he speed by..,fgkf4w
I HAVE 3 HOURS OF ART HOMEWORK TO DO AND ITS DUE TOMORROW,3,"if you say not to asking for help on reddit i will be displeased

Edit: Done phew",fgiufz
A Problem I have.,2,"So Im in my school and yes Im posting this during my Math Class, in the meanwhile of being in Math Class some thots are being annoying towards me. And I tell them to be quiet and I get snitched on by them. And I get blamed for doing everything? It doesn't really make sense and these tiktok thots wont go away.",fgibs6
Anyone else that can relate to this?,3,"Everytime I pass through the store security sensors, they set off even though I didn't shoplift.

I really don't like gaining unecessary attention towards myself so it feels so bad everytime that happens and I garner a few stares from passers-by.

Lowkey developing a fear of passing through them when I haven't done anything wrong.",fgbl3i
Toilet is clogged and water is at the top of the bowl not draining,1,"HELP I left a massive log after not going to the bathroom for multiple days and the pipes are clogged shut, no water draining and particles floating all around. I can’t put the plunger in or else it will overflow please help!",fg38qb
Here for you 👆🏻,7,I’m always here for anyone who wants someone to listen to them !,fg0jwd
Oh boy (problems),5,"Sit down, strap in, it's about to get proper teenage drama bad. There'll be a TL;DR
i'm terribly sorry if this comes across as bragging,
I just need to share this?!

#
Hi, i'm a F17 and slowly freaking the fuck out.
(For the horoscope boys out there i'm a libra and my star sign fits all these problems, so i am doomed) for clarity ive put a date at the bottom so you guys have a 'timeline'?

Okay, i have all the boy problems imaginable.
#
My best friend is in love with me, has openly confessed it to me and wants to just give it a try and says that if it doesn't work out we'll stay friends but i dont believe it. 
He's a M26 and his behaviour is getting out of line, to the point where its bothering me but i cant say anything without hurting him. Also he's a classmate at college. Extra spicy 👌🏻
(03-2020)
#
Another guy (M19) from school expressed his love for me, he's in the year above me. Told his entire class how in love he is with me and how amazing i am. Went out with him to a concert once, as friends. Then i couldnt get back due to the public transport, and i slept over at his place. He then told his whole class that we slept together but we didnt?! I had to turn him down 12 times..
Now after a month of silence he texted me again so i blocked him and hopefully he'll ignore me at school. Oh also my teachers got wind of that and my health counselor made me have a chat with her because of my behaviour around boys?! 
And that i wont be allowed on certain trips and projects if i didnt stop acting like i did. Mind you i didnt do anything that dude told his class a bunch of whack things and now its my fault?
(12/01-2019/2020)
#
Okay so i'm good friends with two brothers.
One is M20 and the other is M23, i do scouting with both of them and often after were done in the evening we go to their house for a drink.
Now with M23 we go to movies, sail a lot, just generally hang out etc. We're good friends. Now about a year and a half ago i asked him if he was into me because he was giving me vague signs. And at that point i wasnt into him or anything but i just needed to know. Now this week he came back from a trip to America for uni and we went to the movies and finally saw each other a lot again and he started to give 'the signs'. The classic putting his arm around me, pulling me in close, cuddling, annoying me by poking me in my side or booping my nose. But only when were alone.
Now outside of being the brother of one of my friends, hes a good friend of my ex. :'( 
Now i dont want to ask him AGAIN if hes into me?!
(03-2020, this is all taking place now yay)
#
Speaking of exes, i have been having weird dreams of my ex boyfriends (M26) new gf (F27) murdering me. Really great 👍🏻
(02-2020)
#
A boy (M21) who i expressed feelings for rejected me and now all of his friends are making fun of me. And making fun of him for me liking him. Such fun.
(11-2019)
#
A guy i had a weird fling with for a while who ended up rejecting me when i wanted to move into a relationship asked me out. I rejected because i'm not into me anymore and now every time i try to meet up with him and play video games as friends he just acts weird. I dont want to stop being friends with all these people who like me and i rejected?!
(02/03-2020)
#
Then there's another guy who i expressed my interest in who said he wasnt ready for a relationship and just kept leading me on saying he was moving on but ended up fighting with me.
(This was obviously toxic but hey im blind)
(12/01/02-2020)
#

TL;DR
basic female teen having a bunch of boys interested in me who I don't want to date for a various list of valid reasons. Then theres the one(s) i do want to date, dont want to me.
I just needed to leave this somewhere because it feels like im going insane. 
Once again, i'm sorry if this comes along as bragging, it is the opposite. ⊙﹏⊙

#

Also for all of you guys' clarity, i dont have an age gap issue, hence some of the guys mentioned are very much older than me. Also i live in Europe and the age of consent is 16.
My friends support my decisions but i feel like they are getting tired of all of my drama + most of the mentioned people my friends know and its embarrassing for the mentioned ones to just be openly outed as liking me, atleast in my opinion?

Also also, i'm currently doing an audio engineer study so its me and 20 other boys. Doesn't make life easier.

Maybe i'm just heavily self obsessed and think that everyone is just in love me
¯\_(ツ)_/¯

-go you for reaching it to the end ( ◜‿◝ )♡",ffnng7
how my whole school goes against me,3,"so this is how it begins.

im currently grade 7 but this happened when i was grade 5. this guy, im gonna call him Luke. we always played soccer with other people in my class and every time i have the ball most of the time (as usual) someone would chase you to get the ball and every time he come for me, he always pushes me and after he done that a few times i kindly told him to stop. he kept on pushing me so i was yelling at him, i even told the teacher once and she/he (i dont remember) told Luke to stop, and he said he would stop but guess what.

he didn't.

i even went to the teacher's office to talk about it and she was talking like it meant nothing

and he continued

because this was my first problem with another student that physically touch me. i told my mom and it kind of went like this (since im to lazy to just tell it in details.):

Mom: yes OP?

me: Mom Luke kept on pushing me at school

Mom: srsly?? push him or punch him if he pushes you again

(mind you i've never hit someone ever since i was in school)

Me: okay..

he pushed me again and the one time i punch him he falls down crying and in my class Luke said he could beat me in a fight soo easily, almost my whole class heard and kept on telling me ""YOU!!?? OUT OF ALL PEOPLE YOU CAN BEAT HIM??? DONT MAKE ME LAUGH""

so yeah as soon as i punch him i go to the office and when i do i got to the principle's office. she looks at me with some sort of death glare and when i told her she told ME i had to go to stay in the office why me???

i still get mad about it today so yeah..

this is my first post so i might not be that good",fflrzv
Being a teen sucks.,5,"You feel like shit all the time and you hate yourself and you don't wanna go out anywhere. And u see other people your age living like a regular teen, talking to be people and hanging out. While u have no friends and you can't even look in the mirror without bursting into tears.",ffau5p
"Im not allright, im sorry",2,"I dont speak english, and im not using a translator or something, so idk if this post is going to be well-writed, im sorry if u find  grammatical errors  
 

I've been in love with a girl that isn't from my country, i know that internet relationship's are not good for me, but this girl, oh man, 5 years or more talking with her, and is like, you're the only persona that im sure that i love, but you're hurting me but i can't release you, she told me today that she found another guy, and she like him, That hurts, hurts a lot, i dont want you to stop saying me that you like me, that i'm special from you, i know that you're going to be happy, and i'm happy about that, but i want to cry a lot, because something inside of me is saying ""bro, i told you, some day this was going to happen"" i want to cry but i really cant, i can't get she out from my head. im writing this trying to calm myself, man, fuck everything im not good..",ff6bdh
I've never had my first kiss,7,"I' almost 18 and i never had a first kiss,  
I feel like the biggest looser ever,

I' bad at english, so keep that in mind",ff37ni
