title,score,body,id
my family and i are being used all along,11,"this happend when my dad married my mom so my aunts and uncles from my dads side where begging my dad for money even though they have a job, and they always wanted to have what my dad had even tho my dad worked hard for this as a teenager and my mom is never being used becauese she know there tricks even tho she warns my dad he thinks she is just jelous of them and my dads freinds, they convince him by saying ¨give me the money in ill get it to u by tmrw¨ but they end up not coming, keeping the money that  my dad gave to them and then they come back after weeks without my dad realising anything and me im being used by my aunts and some freinds so i know a childhood friend since i was a baby so its been 15 yrs since i knew him and now his perants are the cheapest humans to ever exist even though his dad is rich enough but they never buy any thing for there son, he legit has a samsung j5, like bruh so one day i wnet to his house to play on his xbox with him so the xbox asked to sign in so i used my account to sign in to be able to play together the my dad called he said he was outside and then i was in a rush to leave then i told my freind to remove my account from his xbox he said ok but he didint he found a glich that can make him login to my account  and log back to his acconunt and then he can use my xbox live and download games i bought with my money for free so now i told him to do so but he didint and another time he ivited me to his bithday i bought him a $100 giftcard he was happy so ehen he came to my b-day HE HAD NOTHING IN HIS HAND he litterly came to the party play in the swimming pool and eat expensive steak and leave in your oppinion will u still call hime a BFF because i wont at all and yet till now he does the same thing and back to my aunts and uncles, so last year my mom suffred from Leukemia so my aunt found it to be a chance to think my mom will pass away and ask my dad for her jewlery and the rest of her belongings, THEY LIGIT WANT MY MOM TO DIE SO THEY TAKE HER BELONGINGS and i didint get to celabrate 2020 with my mom i only vid called her but now she is ok and living her life in quarintine but now my dad is stuck in another country because they close the airport due to COVID-19 and he cant come back and yet till now he didint tell my aunts and uncles he came because they live at the same country he is at 





thank you for reading 



i would love to see what you think about what i wrote",g5lmr0
Work problems...,9,"So I work at an elementary school through Americorps right? When the schools closed down, the principal (one of my bosses) asked me to check in every day with the vice-principal, Minh. I asked if we could make it a weekly check-in but the vice principal said since principal said we gotta do every day, it's what I have to do.

Well, I did forget some days of the week to check-in. And so my Americorps Supervisor calls me to yell (rant) at me for it.

She's been very inconsistent with the requirements with this whole check-in even though I'm checking in with just the vice principal and not her. Our check-ins are separate. Mind you her job is to make sure I'm doing my job at the school which is why shes concerned with the check-in between me and the vice principal.

In April, since I forgot a couple more days, she called again. And ranted over and over how I'm not professional and even threatening to fire me because I'm being so unprofessional for not checking in with the vice principal. She told me she doesn't care what time I check in just as long as I do it? Since my work at home hrs have been so...all over the place.

Technically it was our Spring Break when I forgot that time so I didn't it was such a big deal.

Well, today she called (EVEN THOUGH I HAVE CHECKED IN every day) and RANTED OVER AND OVER how so I'm so unprofessional and how my check-in times are so late. I asked her what time does she want me to check-in? And I didn't get a specific time. So I send my daily check in to vice-principal and say ill be checking in at 1 pm every day. Then she texts me and says ""NO the requirement is 12:00pm""

She's being very inconsistent with her requirements and expectations and I'm getting sick of her threatening to fire me over this stupid check-in.

Hearing someone call you unreliable, unaccountable, unprofessional, etc. over and over. I cried during our call but I muted it bc I was trying so hard to stay professional.

She said she will not be my reference for whatever job I may be getting next...mind you, I never asked her to.

I don't know what to do. I want to report this to her boss and talk to my vice principal but I don't how to explain it to them.

Thank you for reading this whole thing...I really could use some professional advice on this if there is anything I can do.",g2x57f
I'm stuck in another country with my mom and step-father who apparently can't stop fighting each other,13,"Hi

Well, I'm originally from South America, I live there with my dad. This February I had to come to Europe, where I lived in for seven years before I went back to my country, so I could help my mom take care of my little brothers until she recovered from a serious surgery. My step-father and her are separated, he usually stays in another city because of work and then comes to the city my mom lives in for two weeks so he can see the kids. That's all good, it works for them, but quarantine messed things up, since my step-dad can't go back to the city. My mom and him fight absolutely all the time, sometimes it's over serious problems and sometimes over really small things. It has been like this since I was 13 years old (I'm currently 21), that's why they separated.

The thing is, all of this is taking a toll on my mental health and I haven't been able to go back to my country. The embassy and airline won't answer my emails. I'm getting sick of it, plus I'm starting online classes.

I don't know how I will manage to stay sane. I've tried talking to them calmly, yelling, putting on my headphones on full volume so I can't hear them, going to another room but it doesn't work since the apartment is tiny and I don't have a bedroom for myself.

What can I possibly do? I'm genuinely desperate.",g2oc25
Online school (not serious),5,"This is very mild, and will probably make me sound bratty, but here we go. I had a science project I had to hand in, and usually my teacher would pester us to hand in every part of the assignment (understandably). But because of online school, I forgot to. I handed in the main assignment, but forgot all my research notes. What’s stranger is that I handed in the works cited on a separate page, but had no notes attached. When I got the mark back, I noticed the big fat 0 next to the research notes. I put a lot of effort into them, so I assume I would’ve gotten perfect. My mark would’ve went from an 81% to a 95%, and it infuriates me. I’ve always been soft and broke down at the smallest thing, so this made me very sad, then angry, then quiet. I know this isn’t even really a problem, but it could’ve been avoided if Corona wasn’t happening. Stay safe, do your work, hand it in, wash your hands. I want this whole mess to be over soon.",g2nycw
"im fat, depressed and tired and imma blame it on the lockdown :)",7,"ok so this quarantine has completely fucked me over



i started out with the intent to exercise, but due to my extreme procrastination that plan has been completely flushed, and i (believe i) have packed on a decent amount of fat that wasnt there beforehand. on top of this, i have insomnia, and i never take sleeping pills as they leave me with a migraine, so if i do sleep, its 4am or later. my body seems to have calibrated itself to wake up at 3pm because of this, giving me no time to do ANYTHING.

so, i need either ways to motivate myself, or very easy and quick workouts, and ways to sleep without pills.

any tips? honestly im open to try anything right now. hell, ill even try home remedies.",g26zrr
Computer Mouse problems,2,"My mouse doesn't allow me to move in axis X and Y at the same time (it happened 3 days ago)  and idk what to do , please help me <3  


Thx for ur time :))",g22evq
"My dad left, came back but left again...",9,"Thank you for reading. You can submit your own stories too. 



I feel like i have to speak about this to someone but i feel like there really isn't anybody that is feeling the same. Similar yes for sure.  I just need to get this off my mind.

So my mom and dad wasn't like married together when my mom got pregnant but they did know each other for looong time since childhood so it wasn't like a one night thing you know. But he took off and my mom find out that he had a child coming a few moths away from my birth.  He chose not to be in my life than. So i never saw him. I had one picture of him but i lost it. 

2017 He joined to Facebook and messaged to my mom. He asked how i was doing and if i wanted to see him on Saturday. He was going to some amusement park whit my two brothers. That Saturday i had school and i had this important role to host the event there so i couldn't go. After that he didn't ask to meet again. And why he contacted my mom was and i quote ""My wife died and that kinda woke me up that everything is not forever"" he said. I friended him on Facebook too but he never talked to me, just my mom. In 2019 he posted MY name and my 3 brothers names tattooed on his fingers. And i remind you i have never talked to this man before. Few months later he post the ""In a relationship"" thing in Facebook and weeks later deletes Facebook and i and my mom lost all contact to him. He took off again. 

I'm not sad about it just mad. Because i let him to make me believe that something was going to happen but nothing did.  One thing that i kinda would want is relationship whit my brothers but than i don't want anything to do whit them or my dad. It's just all really confusing...



If you have something bothering your mind share it. It helps you to kinda put things in order if that makes any sense and there's someone that listens you.",g1z4rx
"WANT HER? OR LEAVE HER, BUT DON'T BE STUCKED AND START STINKING",2,"WHEN YOU ARE CAUGHT IN A TRAP THAT'S YOU CAN'T DECIDE THAT YOU SHOULD TALK,CONFESS,SCOLD,CRY OR PROPOSE. IN THIS TIME,THE FIRST STEP IS TO UNDERSTAND THAT YOU ARE IN THE TRAP. DONT BE SO TRIPPY LIKE YOU ARE SMOKING WEED ALL THE DAY. FIRST,JUDGE YOURSELF AND CONCLUDE THAT YOU ARE IN SUCH A TRAP. SECOND,YOU HAVE TO ANALIZE THAT IN WHAT PHASE YOU STARTED A TALK OR CHAT AND NOW, ARE THAT TALKS SAME,OR YOU TWO DODGED ALL THE BULLETS OF A CONCLUSION,AND ARE BUSY CHATTERING REGULARLY.THIRD:- ASK THAT PERSON THAT HE/SHE ARE HAVING THEIR TALKS FROM SOME ANOTHER PERSON,OR THE ONLY PERSON TALKING TO HIM/HER IS YOU, ITS ON YOU THAT HOW DO YOU ASK THEM AND THEY TELL YOU TRUTH OR NOT. FOURTH:- NOW, WHEN THE PERSON WILL TELL YOU THE POINT WE DISCUSSED IN POINT 3, YOU WILL CONCLUDE THAT HOW HE/SHE IS INVOLVED IN YOU. HERE ARE SUCH EXAMPLES:- 1) IF THE PERSON IS BUSY IN A BUSINESS OR AN ENTREPRENEURSHIP,AND DOSEN'T MEET OR REPLY YOU IN SHORT TIME,STAY APART,TAKE THE PERSON AS YOUR FRIEND. THAT PERSON IS MORE LEANED TOWARDS HIS/HER PASSION OR WORK. 
2) IF THAT PERSON TALKS TO MANY OTHER PEOPLE LIKE FRIENDS,OPPOSITE GENDERS ,CLASSMATES,RELATIVES etc, THIS MEANS THAT PERSON DOES NOT KNOW THAT YOU ARE REALLY INTERESTED IN THEM BY YOUR HEART. THEY MAINLY TAKE YOU AS A FRIEND OR A RANDOM PERSON. 4) IF THE PERSON ONLY TALKS TO YOU AND SOME COUNTED CLOSE PEOPLE IN THEIR LIVES,MEANS THAT THEY ARE REALLY LEANED TOWARDS YOU.HE/SHE GIVES YOU TIME AND REALLY FEELS EXCITEMENT WHEN THEY DONT TALK TO YOU. THE PERSON CAN TAKE YOU AS A FRIEND OR A LIFE PARTNER. BUT,THEY REALLY GIVE A PART TO YOU,DO NOT PUT YOUR EGO WHILE TALKING TO THEM AND THEY REALLY ARE INDEED TO YOU.",g1uw96
My close friends for three years in high school are cutting me off,9,I have three best friends throughout my high school life. After many bad experience with friendship groups and drama. I have finally found my close friends in high school which is my ex three close friends now. How it all started in my opinion and what I’m about to express is what I feel like happened and it could be different on what they have seen or what their side of the story could be. I first met two of my best friends in the end of year 7 when I was bullied with my other toxic friendship groups and when I first met them they were very nice and understanding. They would tell me they would always be here whenever I have problems and they always listened to me complain or rant about my family problems or issues in my life time. I would sometimes make funny jokes like for example how people act and stupid dad jokes. They all laughed and they would always hype me up for the jokes I made and it actually made me happier that someone could finally understand me for who I am. So then my jokes got more funnier and they would laugh more louder. After one year pasted my two close friends made friends with another girl and she joined our group and to be honest at first I disliked her and was jealous of her because she was used to be from the popular group and I hated the way she acted. While I started to feel excluded and left out of the group. So I told my two close friends about how I felt and they completely Ignored my opinion. Pretending nothing has happened. While days kept going on I stoped mentioning my problems about the new girl in our group and started to communicate with her and hang out with her more often thinking then I would be able to fit in more. But as time went she’s actually gorgeous and an out going person and I actually got closer with her more than my other two best friends. The four of us are all having fun and talk together through out our last year of high school. Soon time went out and things started to go down. My problems got worse and I would want people to listen to my thoughts I try not to always complain to them about it and I would often hear them complaining about things in their life’s and I found it equal because that’s what friends do. But then soon I found out that my friends are once again distancing themselves with me. I tired to find reason and I learn from my past mistakes in other friendship groups until I finally said it out to them that I felt left out again. Then they finally all stood up and talked about the problems but it never came to a conclusion because everyone was just crying about the situation and ranting out all my mistakes and they never talked about their own. They told me they are sick of me ranting. They are sick of my jokes because it makes them feel uncomfortable and weird about themselves. But I found it really weird because they never told me instead blaming the problems all on me and telling me how I am the person causing all the dramas in this friendship group. But that’s not my intention to cause drama. I just wanted to make them happy and laugh so all my jokes are just to make them happy when they are upset and my problems I could not talk about it again only if you guys could of told me earlier. Instead of telling me at the end the year when everyone is gonna graduate soon. They said that my problems are affecting their own mental health and it’s killing them and they are sad because they have enough problems on their mind too. But I hate the fact that they didn’t tell me and I asked them that too and what they told me was they hide it away from me thinking they will get judged about their opinions on things if they stated their opinions on things I did or said and it made me really really upset. Because I thought we were all best friends and if we talk about things and if we don’t like it you have to say it out because then none of us will change for the better. It made me feel like a shit head that I am not counted as a friend because they hide their most important thoughts in things away from me. I could still remember that day where all four of us were crying our brains out. But all their problems were targeted towards me that I am the problem and drama causer. That day was the last day of school since the school got shut down the next day because of the coronavirus going on. So none of us get to solve or talk it out. So I send them each are very very important text message and explained my wrong and hope they would accept my apology. But instead they turned really cold to me and started to lash out everything on how I made their life’s horrible and things are never gonna be the same anymore. It’s a build up problem because since year 7 they would laugh in my jokes and told me that they would always listen and be by my side when problems rises and I know people do change over time but these words hurt me the most that my friends are leaving me because of me trying my hardest to fit in. I apologised for what I did in the past to create this problem. But they never apologised for the words they said or called me. That’s what made me sad and proud at the same time. That I admitted what I did wrong in this friendship even though I think I really didn’t because it was a misunderstanding of communication since they NEVER told me what they are thinking. But I can also understand them at the same time because it’s hard to tell one of your friends about this. I admit what I did and I’m proud of that. They didn’t do it and it’s ok because everyone has their own choice. It’s their Choice to do what they think is correct and in the end they decided to cut me of. They said we can acquaintances but every time when I text them like “hi” or “how are you” they Igrone me or leave me on read. I realised that just some things that caused them to turn completely cold to me. I guess In the future I will learn from my mistakes and find a true friend who will understand me better than high school.,g1r9qq
Brother,5,This is my first time telling anyone about this so my older brother scares me when we were younger he would do anything in his power to keep my mouth shut about him dipping or smoking he’d pin me down on the floor and hit me and as time went on it got worse one day he just came in my room and just started hitting me  as his friends just watch in the doorway and more recently he’s been getting into drugs and cussing out my mom and threatening to kill me to get money out of my mom luckily i did get out of these situations mostly unharmed ever since then I’ve been having nightmares about him killing me or my little brother and it feels like it might happen this whole situation with my brother has caused a lot of problems for me and I don’t what to do,g1eixl
Reddit is my problem right now... I can only view like half of the messages I get,4,"WTF? Does anyone else get this? I can see the notification on my phone and like the first few words of a comment but I can't find a new message on the ap or the website...

Also, On about half the posts I try to comment on, when I'm done and hit post I get an ""oops, something went wrong"" error.

WTF?",g1b8e4
I feel like Reddit isn't for me.,8,Pretty much anything I post I end up getting hate. I think I have this Reddit thing all wrong. It's definitely time to quit reddit,g17yba
I hate my family (especially my brother) I wish he can just disappear or something,5,"I don’t want to be mean or selfish but I think I am  now because I am gonna put it here about how shitty and nasty my younger brother is. On all the shit he has caused me and made me who I am now. How many of my fucking mental health are linked from what he had done. My family were always fighting and we’re very violent with each other so since when I was young. I had many bad experience with it and I hated home. I use to think I lived in such a perfect life. Not until my brother was born. His two faced since when he was young. He would show his cute innocent side to my mum or dad or anyone in the family tree just to get sympathy and love. While he treats me and my younger sister with disrespect and hate. He would spit on me every time when I get out of the shower clean. Throw dirt on my clean washed blanket thinking it’s so fun to see my reaction. Pick his nose and wipe it at me. Bite his toe nail and throw it at me or in my room when I’m not around. Wear his dirty shoes and jump on my bed. Mess up my clean laundry. Use his dirty hands to touch me and It caused me to have a trauma that my things will never get clean if I’m around that shit head and it turned me into a psycho clean freak that wants everything to be clean. Since he is the second oldest and is the only boy in the three children I found that my love in this family were gone. I’m the oldest and in the Asian family you were expected to do many things for the family. My brother was a little spoiled brat he gets money from my dad and my grandparents since he is the only boy so he is pretty much biased around the family tree. While my younger sister is the youngest so she needs more care and you could say I was jealous that all my love and care was all gone just because I was the oldest I had to work three jobs and the money I earn we’re either taken away by my parents to buy stuff for my brother and sister. I don’t want to live such a horrible life. Even words can’t explain my feelings right now. My brother he swears a lot around the house hold and my parents don’t care because he is spoiled like I said. He would always boss me to be his slave and he will hit me  or pull my hair whenever he doesn’t like something. He takes my stuff without Permission and breaks my books destroy my makeup and items in my room. He yells all the time and one time mum and dad was always fighting about him. Such as one time when my dad cooked him noodles and he doesn’t like it and he started to throw a tantrum mum came and started to yell at my dad because of a cup of noodle on how my brother didn’t like the taste. Such a petty thing to fight for. That day I was the one who had to stop them from fighting and I was protecting my mum from my dad beating her. My brother is too spoiled and that time he was 13 years old. Still acting like a baby. When he was younger about 6 or 7 years old every time when he does something wrong I would get blamed for it since I’m the oldest and I would get hit and beat up. I turned suicidal after many beat up and harassment from my brother and parents. My brother would stole money from my parents and use it for his stupid game. He would take my parents credit card and type in the number and spend about $700 dollars on a freaking game. When he was younger he would stole candies from shops and eggs from our next door neighbours. He takes things with out permission. Every time when I’m sad I would take some animals home, such as rabbits and cat and look after them and put them in our garden.  My brother would harass my cat and play with it really rough and when my cat attacks him for it he would kick my cat. He even stole my bunny rabbit ‘Pluto’ and he will threaten me with many things if he doesn’t get what he wanted because my parents has his back. I would get mad at him and tell him to stop because I’m not a very patient person because I hate my brother since he was young. So some times I would yell at him and tell him to back off for all the shit things he do but then he runs off and acts all innocent to my mum or dad and I would get beat again and yelled at. I just don’t understand. My brother had stole and had break many things in this house hold but my parents just never gets mad at him rather think his doing is good. His never going to learn his lesson and soon he will be raised to be a criminal. Since he is the only boy my parents would never do anything to hurt him and he never had to wash any of his clothes or do any kind of chores around the house. Rather I had to do many things. I hate living my life like this. Really hate it and wish some days it could end.",g10x4e
I get pissed off at ignorance,3,"For example, if someone doesn’t know the answer to a simple question in a group, in my mind I will think “bruh it’s the easiest  stfu” and just kind of go off at myself, it happens all the time and I know it’s wrong because people have different abilities etc etc. Another example is say in a classroom and a teacher explains something basic, and someone then is confused over it after, despite me finding the explanation really simple and self explanatory. Anyone else just sometimes experience this?",g07kls
Past HS drama,0,"So a long time ago in high school, idk why I ever did this I was being really dumb and I regret and I can not stop thinking about this till this day. But I had 2 friends who always talked behind their backs to me. I told my friends that both of them were talking bad about eachother and one of my friends wanted evidence because she thought I was lying. One day my friend talked bad about another friend so I decided to record the conversation and send it. Currently this is the past and these 2 aren’t friends due to other reasons but the friend I recorded knows I did this and she does forgive me. However, the friend that I gave the recording to in high school, her mom is totally crazy and she emailed my high school teacher saying my friend and I bullied the friend in high school. To this day I worry that I made a big mistake by recording the conversation and it will later impact our lives. However I know it’s just high school drama and everyone does talk behind others back. So I’m scared that the mom will like show everyone or the friend that I sent the recording to will show everyone and my other friend will be affected and so will I... 
This happened like 3-4 years ago but I still think to this day I made a bad mistake. Please give me some advice or thoughts.",g06k98
