title,score,body,id
"Hello, I think(?)",3,"It's my first time here and I don't think anybody will read this.

Anyways I'm kind of annoyed (¡!) I'm a pretty awful artist and all my childhood consisted on drawing things adults ended laughing at, so I grew a toxic habit of turn my drawings down. Now, I'm 22 yo and I really want to learn how to draw and maybe (just maybe) show people what I can do. But I don't have enough confidence to start. I would like tips, help or anything (?

(btw sorry for my english)",fzn9zc
YouTube comments,3,I put on the comments for a YouTube vid and now it won't turn off and I don't no how to turn it off I'm not changing YouTube comments on my YouTube but trying to simply use the comment section by turning it off need help,fybsb7
Anyone else arguing more with their roommates in quarantine?,5,My roommates and I can't stop fighting and I'm going crazyyy. Anyone else feel me?,fxvlgo
A problem I had for two years,3,"Before I went into middleschool, I was a happy little kid that would always talk to others and make goofy and funny things to make others laugh. Some of the kids that I mess with don't really have a problem with me and sometimes would ask me if I would like to play games in the playground like the floor is lava, tag, and hide n seek. Other kids however (that were mostly girls), saw me as a annoying kid who does dumb things and doesn't know any better. So the girls rarely ever talked to me. Sometimes I would be arguing with some girls since they would act defensive and would sometimes tease for the things I do. Luckily I had a very nice teacher and would diffuse the situation quickly. The girls will sometimes tease me for the things, but it didn't really bother me since me and my friend would always laugh it off. But then, once my elementary days were over and I had to go a middle school for the first time, things got pretty bad.

Once my first day of middle school began, I was sort of shy and didn't really talked that much since my friend from elementary school was going to a different middle school so I had no friends to talk to. My first impression to my classmates wasn't that good, I acted pretty retarded to them as of what I've done to make kids in my elementary school laugh. Once lunch began,  
I sat in a small table were couple of my classmates were sitting in. I attempt to make ""funny"" things that I deeply regret doing like eating things of the floor, eating 
scraps of food that my classmates didn't want, and make weird jokes that weren't really funny at all. Worst part about my classmates was that some of them were girls that were from my elementary school. The girls didn't really like me at all and started spreading rumors about me that would later destroy my reputation with my classmates. Another bad thing about my classmates is a small group of ghetto kids that weren't really nice to others. Once they heard about the rumors, they pretty much started tormenting me everyday calling me names, stealing some of my belongings, and even sometimes threatening me that they were gonna beat me up. I felt powerless because of them. Around the middle of the school year, everyone was pretty much against me, they all pretended I had some disease which they called Ebola and started physically distancing themselves from me, pretty much causing me to be lonely for the rest of the school year. It gotten so bad to a point where everytime 
I sit near to ant of my class, they would scooch away from me or tell to please sit somewhere else. I would also pretend I was sleeping on the table while in reality I was quietly sobbing from all this torment I had to deal 
with every day. Onetime one of the ghetto kids was mad at me for something that I can't remember and started calling names and other bs at me. I then snapped and threw a small milk carton at him and it hit him in his. After this, he told me that me and him are going to fight in bathroom. I was pretty mad at him so I pretty much shrugged it off. Then when my class period started he came to my table and told to follow him into the bathroom. I knew what he was doing so told him no. Then he brought his friend and tried to encourage me to follow him to the bathroom. I got angry at him and quietly threw a cuss word at him. He heard me though, and got pissed off and decided to shove my workbook off my desk. Luckily my teacher finally realizes whats going and stopped the ghetto kid from harassing me. But at that point, I hit my breaking point and started sobbing onto the desk. That day was the day were my personality started to drastically change. After my school uear was finally over and I moved on to 7th grade. I was no longer that happy kid that would always attempt to make funny jokes to make other people laugh. I was now just some kid that barely talked to other.

As of writing this now, Im now a lot more energetic than before and now have friends that I would sometimes talk. But I still don't talk that much to others since I fear that they would gonna tell me to shut up or say that they don't care what im talking. Sometimes though, I would fight off my anxiety by telling myself that if they don't care about the things I say, then just move on and say something else. I would also have these episodes where my confidence to do anything just goes down the drain and their will voices of my classmates in my head telling that whatever I was doing is dumb or tell me that my opinions are dumb.

Sorry you had to hear my long ass sob story about me. Hopefully some of yall can give some advice to deal with my anxiety and these episodes I have.",fxkty1
why i hate him,2,"I don like to do this but im on my last straw. I can't keep it in anymore. My father has ruined my entire life, let me explain. I was once a young kid(not anymore im an adult now) with full of character i was funny, i was well liked and I loved my life up until 8 grade (many years ago) where i got into a huge fight with my ""father"" where he ended up  pulling me up and throwing me on a wall where i got my t shirt ripped I was only 13 at the time but that wasn't the worst part. If it was just that i could've forgiven him however my ""father"" then proceeded to not talk to me for a full year basically was neglected by him not one word. He muted me out. I don't know who does that to their 13 year old son I was still a kid. That obviously ended up destroying me emotionally and mentally. I lost all confidence in myself, I lost my friends, I became socially anxious as i thought i was a good for nothing since even my own father gave up on me, I also became extremely depressed and was suicidal. My chance of having a normal teenage life was done at that point btw all these he caused I am still dealing with them many many years later what also bothers me about is wich kind of parent stops talking to their own little son and how do you not think of the negative mental effects it will have on him. My life became hell at the point. The worst part is that my ""father"" never apologised to me about this as i was pretty much forced after a year to apologise to him. We then started being ""okay"" with each other after that however the damage was already for about 2 years we went on like nothing happened but i wasnt the same still struggling with everything he caused me. I decided to cut him out tho after about 2 years and stop speaking to him due to what he had done years passed. We still live under the same roof tho sadly as i cannot afford a place of my own yet. That's not the only thing that i hate about my ""father"" even though i cannot if he was mentally abusive when i was younger i definitely he would sometimes hit me a bit too much and would scream at me too much. Another thing that cannot ever forgive him for is that he cheated on my mom even though she does everything for him. She cooks, cleans and is borderline his full time servant while he sits and watches tv and gets mad often. So my mom gives her all for him and that loser cheats on her. The only thing he does is he has a hardworking job where he works like 80 hours a week but that doesn't matter as i barely any of the money makes and anyways i want nothing to do with it. He is a good breadwinner tho i can't lie. As of march 2020 i am still dealing with everything my dad caused me mentally my life has been because of him and i've also been suicidal imagine killing myself cause of everything he caused me. Still that the person that is supposed to love me and protect me gave up on me and caused more pain then anyone else in this world. Laslty, i just wanna know if any of you have good tips on how i can deal with this and what is your opinion on this situation. Oh and thank you guys so much for reading this and responding you don't know how much means to me :)",fxddak
Help. Please fast.,2,"Hey lads and lasses. So this is probably a really minor problem that I’m too stupid to fix. But here it goes. I have a really comfortable mattress and really warm duvets. But last night I couldn’t get to sleep until about 2 hours from when my dad sent me up to bed. I then woke up (now) and I jolted up instantly. I then for no reason walked into the bathroom and sat on the toilet. I got off and took a drink of water and when I left my head hurt and I was off balance. I don’t know what the hell is going on with my body. Please everyone help. Fast. I really need some sleep.

Edit:
If it’s any help:
• I’m below 15
• I sleep with my dog",fwx5y4
People leave me and I don't know why.,3,"It's a long one. Sorry for any typos. 

Okay, so here's my problem. All my life, friends would just leave me, with no explanation. 

One friend I had for 5 years, and who was a part of the family, and my mom loved her like a daughter, left me to hang out with a new girl who dated her brother at the time. I messaged her yesterday (about five years after we stopped hanging out) and told her everything that still bothered me after all those years, and she said it was all my fault and that I must be on drugs to write that stuff to her. I didn't reply to that because she does not deserve it. But she did leave. 

One girl, I really clicked with a year ago, (she is my boyfriend's sister's childhood friend) just stopped texting me or going out for coffee. I have no idea why. Maybe I should ask her, but I'm nervous about it. I don't want hee to assume that I'm clingy or something. 

One girl, for whom I thought was literary my soulmate, changed her attitude when I got a boyfriend. When we started hanging out, I didn't have a boyfriend, neither did she, and we spent every moment together. About 2 years after hanging out, I met my boyfriend. She was happy, she liked him. About 3 months into our relationship, when she realized we were serious, she changed her attitude. I realized something was wrong, but I didn't want to jump to any conclusions. Then I got a job in a city where he lived too, and it all changed. I called her every day after work, and she wouldn' t ask me how I was, how he was, she would just talk about herself. Then we had a huge fight where she said that we're both retarded and deserve each other, that our relationship sucks. We didn't speak for a month and kinda patched it up. Now we talk every 2-3 months, sometimes not even then. I miss her, but whenever I think about what she said to me and how I felt it makes me sick. 

I can't say that I didn't fuck up some of the other friendships I had, because I can't stand when people sneak behind my back or if they patronize me. I'm not perfect and I don't act like I am, but I believe that I didn't hurt nobody, at least not intentionally. 

I don't know what is it about me that makes people leave. Do you think there's something wrong with me?",fwi9uo
my dad wants to kick me out cuz i shouted at my sis and i have no where to go what to do ?,4,,fvkcid
is there something wrong about my friendship logic?,3,"hey guys how are you all doing...
i have plenty of friends irl and i want to make more friends on the internet...
i knew some friends on the internet and i check on them everyday to see how are they doing you know...
but they dont check on me...i mean i want to feel like am his/her friend...and when i ask them about it it they say : you are not my close friend and i dont need to check on you because am not your mother...

seriously guys i feft pain because they treat me like am a stranger...i mean i check on them for 6 month and when i was away from discord for week no one text me...

guys if you think of me as a stupid then plz tell me the right thing about it because apparently their logic of friendship is so mess up..

or is it me who mess up...

give me your opinion about this and dont worry feel free to say whatever you want...am okay with that...thank you for reading this and sorry for bothering you.  have a good day to you all",fvdk4e
Help me please I’m desperate,2,Ok so I was watchin dr Phil on YouTube when I came across a episode called family on fire.The episode was made in 2014 and it’s about a girl named Marie who was getting emotionally and physically abused by her parents.the video was just a clip so I don’t know what happened to Marie. I felt so bad for her when I was watching and not knowing what happened to her is literally making me lose my mind. Can someone please tell me what happened to Marie thank you so much.,fvbl6k
Can’t keep my customers safe.,1,I’ve been 2 weeks without the ability to buy Clorox wipes and disinfectant spray. I would be spraying down anything I touch for this. I’m a plumber and I have to go inside peoples homes. Can’t buy any PPE or things to keep them safe from me if I get any covid on my clothes or things like that. These dumb tweaker idiots buying all the stuff I need to keep them safe.,fv1zws
Father issues,3,"Hi I’m Henry and I’m 14, I’ll turn 15 later this month.
I get a pretty good amount of support from my friends and family and that’s wonderful. I really love everyone around me. 

Other than the other house I have to go to, my father is on surface level disrespectful to me, and is major subscribed to diet racism/misogyny. But when he and my mom were together he was mentally abusive and manipulative.

In recent years I’ve shown him I don’t like him and I’m cold with him, showing no interest and spending no extra time than I must with him.
But this past year I’ve developed what seems to be father issues. I’ve gotten attached to one of my male teachers, a simple compliment from him means the world to me. He’s the closest thing to a father I have in my life.

I don’t know how to get over this or fix this, I have this craving to just have some deep voiced man say I’m proud of you son.",fuqejk
Scammed out of money for a nintendo switch TWICE!,5,"I recently tried to buy a Nintendo switch of someone on Depop, this was through PayPal family and friends  and then I never received the switch and the person deleted the account which I later found out was hacked hence the hacker taking my money and deleting the account. 
I then tried to buy one off someone else on vinted. 
Vinted are a bit different where the money isn't released to the seller until I say that the item has been delivered.
This person wouldn't send unless they had the money so being as gullible as I am I released the money to them before they sent it, they have now also deleted their account and I have no proof of postage from either. 
It's pretty obvious I've been scammed and both PayPal and vinted say I can't get my money back. 

I'm with nationwide and I have submitted 2 visa disputes to them. 

I have argued profusely with both PayPal and vinted to get my money back and they said there's nothing I can do. 

Basically I'm asking if theres any likelihood I'll get my money back from the bank? 

I had no buyer protection with PayPal as it was family and friends bit vinted said my buyer protection was no longer valid because I released the money before getting the item. 

I'm out £260 ( basically enough to buy a brans new switch)  and I don't need any criticism from anyone as I already know how much of an idiot I've been to fall for this twice. 
I'm asking for advice and help.",ftvd6g
Should I be mad about my little sister getting things without trying while I have to work my butt off for things?,2,"sorry for bad grammar and spelling just wanted to rant about this problem I had that came out around an hour ago
Recently since the new ACNH switch came out I've been begging my parents to get me one and recently my little sister (8years old) suddenly wants it. I kept telling my parents a bunch of reasons why she shouldnt get it for example she broke her charger for her ipad around 4-5+ times last year and also had a replace/fix her ipad a couple times during that same year. I also told my parents I'd they do get her one they would be wasting $300 escpially if I'm correct you cant get warranty and you would have to buy another switch to replace.
So the real problem starts about an hour ago tonight. My sister and my grandma(I have a bad relationship with) talked about the ACNH switch and said to her she'll buy her one with her money tomorrow and told my dad. Over course being in the same room as mu dad I overheard their conversation and got really pissed about it. Since all my sister had todo was tell my grandma to buy her one. While I beg for my parents to try and get me one. What sucks even more is that all my devices like my laptop, games, and a switch(I wanted another one because I am a big fan of the game and the design)  I earned all of those with getting good grades and honor rolls. So I told my dad it was unfair and he said, "" it's your grandma's money and you should be happy for your sister"" And of course I'm pissed cause ik my grandma hates me and I hate her (more into that another time) and my grandma adores my sister.
A week before  I tried to give my sister my old 3ds and a few minutes later to get changed she fricking put my 3ds back on the table and told me it was ugly and wanted the switch. I got pissed because I gave her that 3ds so she could learn if she actually wants the switch or not because I have and also for just 1 game. 
Then yesterday she told my dad when he came home she didnt want the switch then I'm there all happy because I get a chance. Back to present day all the fucking sudden she wants it now.

Is wrong for me to get mad her and should I be happy for her instead?",fsxpxl
Feel free to read this!,8,"Okay so .... My mom is 38 years old and Im about to be 20 years old this May, my mom has had 8-9 abortions since I’ve been born and their all with these guys she’s just met! I really don’t know what to say at this point because I just feel some kind of way about this almost makes me feel neglected or something. I’ve been around my mom since birth. I have a younger sister who is 18 and Im the oldest (btw im a guy). No relationship with my dad but I know who he is and all but we don’t talk or see each other I really don’t think he to much cares for me or my sister. My mom had me at 18 which isn’t bad I guess but I was not planned to be here and my mom even told me herself that her and my dad were just having sex no kind of relationship at all and I came along so I don’t really know how to take that but it kind of hurts sometimes ya know ..... I just always have a what if mindset and I can really tell my family doesn’t too much care about me I mean I really hate life for having me here.... im just going to end this but please comment below I really would like to read!",fsppyu
Problem with my big brother,6,My big brother and I have to share the same room so I have nowhere to go when we go to bed and he starts bitching at me. He thinks he knows everything so when I have a problem he gives the shitiest advice ever and the gets pissy when I refuse his advice. I can't do anything to make him STFU and it is a serious problem as he is wearing me down every night. What do I do?,fs6t3v
Boys,3,"Can anyone please tell me how to ""politely"" tell my FWB that he's getting a little possessive over me and we should break off our arrangement?",froa1a
"Help, my dad and stepmother had another disaggreement!!!!!",2,"After having a my quesadilla for lunch, so.. while I was having my soda while watching golf, it just changed into ""Netflix"" by itself, so my dad just yelled and my stepmother started going off and they blamed at each other whose fault it was, and I am in a deep shock, so I am about to cry....",frcua8
I don't have a voice in my house,4,"My family is complicated to say the least. From an early point in my life my mom did abuse my sisters and I, which really made me a quiet person even to this day. I always feel like I don't have a voice in many situations, and most of the time I don't. If a disagreement happens between my sister and i, I would also get pieced out because I don't make money or have a job. Anyways I got out of that situation with my mom which was extremely taxing on me, and I moved in with my oldest sister, kia, around the age of 15 or 16, I'm 18 now. I can't thank my sister enough for what she has done but it comes with a few problems. My sister restricts so much from me and even my friends can see it too, for example before this corona stuff happened, I've had to babysit almost every week for multiple times a week, for multiple hours until midnight or so. I would get angry at her but not say anything about it because one time she threatened to kick me out of her house, and I have nowhere else to go. She says our family is a team, which I highly dislike because we're more than a team, we're a family. I also dislike this stigma because she treats me like I'm the worse person ever at times and I'm a good student and I'm respectful. She restricts my video game usage, which at first I understood and abided by. But now she's restricting it even more and I have no clue why. I did research on internet usage on games and electricity usage on games as well because it might be a financial thing. When I presented Kia with this information she told me she didn't care. Video games don't take up that many resources when compared to cable boxes or phones and honestly games helps me cope with alot of the mental problems that I have, and helps me actually become happy despite me overthinking, or not being sure of myself. She limited my entire wifi usage for my other sister, Quiana, and I for 4 shared hours. So school work, YouTube, phone usage, and game playing all have to fall between those four hours. I don't understand why she would implement this considering my sister's husband isn't even out of a job considering all of this corona stuff. The only enjoyment I've had so far is playing video games/watching anime for the short time I'm available to. At times like this sure my mom would beat me and whatnot but I wonder if she would limit my passions like Kia does. It really hurts because it's like her way of telling me ""I don't care about how you find your happiness."" The dream I set for myself is to be a gaming YouTuber funny enough, but knowing that my family knows this they just don't care about my passion for editing videos. It's really hard for me to speak up considering I was abused before and Kia dangles that over my head. For college I need a PC which I'm not asking for it here it's just needed for a film college I got accepted into and she expects me to ask my mom for it. I seriously hate my mom for the things she's done to me. Why would I talk to her? Why would I ask her for stuff like nothing's never happened?",fra83u
"Shop still open, people shaking hands to congratulate you dont have corona. let's all buy newspapers and boiled sweets.",4,"Fuck me, don't get me wrong it's stupid but part of me likes it in the uk. I'll die happy if I have a rhubarb and custard if it the last thing I do.",fr6u2x
Parents that I believe are crazy,1,"Hey fellow Redditors, 
I don't know if my parents are exactly crazy but I needed to know so here it is. Btw I'm 17(f) a few months away from my 18th birthday.
Today I went to work in the morning from 7:00 to 14:00 and after that my father decided to be ""nice"" and ""allowed"" me to watch one online lesson today, two tomorrow before noon and one on Sunday, and then he told me that he expected me to go vacuum my room and wash all the bathrooms, sinks, and mirrors in the house before my mom got home. My mom comes home at 4 so I was a bit pressed on time but apparently she didn't mind that I didn't do what I was supposed to at first so my parents went to get groceries and left me at home and I decided to take a little break, when they came back my mom told me that I should continue relaxing and she went to clean the bathroom, sinks and mirrors herself. When I said that I already promised to do it and was going to in like half an hour she sarcastically said that it's fine and I should just ""continue not doing anything useful"" and then she added that ""it's not like you ever do anything useful"" then my grandfather came to the kitchen where I was sitting and yelled at me about how ungrateful I am and how I'm just wasting time and forcing my mom to do my work and that I always act selfishly like that. Then my father chimed in about how this is not the first time I have disregarded their wishes and ignored my chores. I was angry that they were all yelling at me but not really surprised because they do this almost every weekend exept my grandfather usually doesn't add to this conversation. Then I went and finished what was left and when I came back to the kitchen my father again emphasized that I should have done it as soon as I came back from work and how I should have known better than to delay it since I apparently do nothing useful all day.
I'm sorry for bothering you all but I need to know am I overreacting and am I really that horribly selfish and a horrible daughter.",fqccc5
