title,score,body,id
Girls make no sense: Case example,2,"I'm a sophomore in high school and recently and because I'm not a loser I talk to girls, sometimes, it's not a challenge. However something terrible happened. In my math class, I was seated with 3 other girls in a table group of 4. 

I've sat with them for about 6 months now and every day my confusion and deep annoyance only grows. Initially I thought ""Hell yeah 3 girls this is pretty sweet."" However I was very wrong, it was not sweet at all. 

I had always heard of guys saying how troublesome and confusing girls where and how they couldn't understand their interests and stuff, but I always thought It was just the ""guy"" thing to do and you just kinda had to say you didn't get girls because you where a guy. Turns out I was wrong, kinda.

So we hit it off and our table group develops a friendly group dynamic. So we can be cordial but most the time we are harmlessly being mean to each other just because. However then things began getting weird. These females could just start talking about the boys they like and their relationships and what who said to whoever and other mind-bendingly boring stuff. They could talk for like 40 minutes about just garbage. I realized they where the exception because other girls don't ONLY talk about or as involved in melodrama as these girls do. 

Eventually the teacher kind of gave up on telling them to be quite and only does when she needs to address the class or lecture. Math comes very easily to me and the class goes slow because we have a stupid class, and also they're juniors who managed to fail the class and are repeating. The stupidest people get to set the pace for the whole class unfortunately. So besides studying the girls, I've done other productive things like learn more code, learn more spanish outside of spanish class, etc. 

Anyway that's kinda the context. So the females, they're like a whole other species, they have very different interests, senses of humor, etc. They say things that are totally not funny and laugh about it. I  know it works both ways but I just cannot understand them. 

Now to get specific. I'll start with the best girl. Daniella, she's a transfer student from Spain, she stayed for about 4 months until she had to unfortunately leave, she was smart and nice and her problems which where very similar to the other 2 girls problems where actually interesting. She was mad rich, she had a legit silver rolex and went to a private school. She only came here to learn english and get grounded.  Anyway she's gone but she was great, and it was really cool to hear about the lifestyle she lived.

Anyway the next caste

Ember, Katy, and Ashley

Ember and Katy are both your normal gossipy blonde bitchy girls. Both just talk about boys and makeup and cliche girl stuff. 

Ashley was Daniella's replacement. I was very unsure about her, I was sad to see Daniella get replaced the day after she left. But it turned out Ashley was actually not so bad. She was similar to the other two in that she also was gossipy but she was emotionally and socially smarter. She was also very introspective. Weirdly, she extremely bad at math, even though I considered her the smartest of the girls. 

Anyway Ember made probably the least sense. She had this hearing aid she always wore. I kept telling her it's dangerous because now the government has complete control over one of her senses, and what If someone hacked into it? She would also wear these massive hoop earrings. I hated them. Anytime she wore them I would tell her how goofy they where and how they made no sense. I could fit my head through them. And for her own safety they need to be removed. She never listens to my advice though, I kept on telling her how if she gets near a powerful magnet they are going to tear her ear. 

Ember has been my main concern. She's the most hopeless. Katy is the most bitchy and puts on the ""tough delinquent girl"" act the strongest. But she is the most academic of the girls. She's not terrible if you get to know her.

Ember however is very stupid. One day, she decided to unlearn the rules of basic math. All of a sudden, she didn't understand how negatives worked. She thought a negative minus a negative would result in a more negative number, which it doesn't. However she somehow reached this understanding and had such extreme confidence in it that it was impossible to change her mind without getting the teacher behind me. 

That's when I realized I had to help her with tough love. I so began calling her stupid every chance I got. My hope was she would realize that she is, in fact, stupid. This way at least when she says something stupid, she won't do it with such confidence. Or maybe, after she realizes she's stupid, she will gain the ability to think about the things she says, and hopefully think something like ""oh wait, I need to remember how dumb I am, maybe I should reconsider if what I'm saying is right or if I should say it at all?"" 

Unfortunately I got tired of my efforts going unappreciated, so I stopped. They were also being very mean to me in response, even after I explained my motivations. 

Nothing major has happened recently. I am looking for new soft skills to learn while in class. I need a use for my time.",fevkvz
Flying things in my room,2,"Someone weird flying insects and stuff get in my room and start flying around. Right now there is a moth flying around pissing me off. Most the time it's some sort of light-attracted insect that shows itself when I turn my lights off and keep my laptop on to attempt to enter my pre-sleep phase. Yeah I can see it, while I'm typing this it's just fucking moving around like it's king of the world.",fev249
I am having issues with my body and mental health,2,"Hi just a girl here
I’m 13 and I’m struggling with my body image and in the past have thrown myself up. I also am struggling with my mental Heath and have self harmed in the the past no longer. I feel this numbness towards life and I think I might be bisexual I’m not sure I’m just not ready to face life and I feel like my parents will be better off without me

Please help me",felr7z
i want to die,5,"a while ago i realised i might have muscular dystrophy, which means i am going to have a slow and depressing death. not too long from now i wont be able to walk, i'm going to loose my favoured hand.

because of this i fell off on my school work last semester and failed more than half of my modules which means my sponsor cutting me off, but i cant afford to pay on my own.

i haven't told my single mother yet and this is stressing me out and now am seriously considering suicide",feefw4
У меня психологические проблемы,1,"Я начал терять интерес к жизни, хотя мне всего лишь 17. Жизнь кажется мне круговоротом повторяющихся и заебавших меня событий. Я часто думаю о смерти и наверное смог бы выстрелить себе в голову, была бы такая возможность. С этим я не делюсь с близкими и с виду я обычный веселый парень, но внутри меня твориться пиздец. Как то я раз я попытался с этим поделиться с другом, но он просто посмеялся. Теперь я тут....",fdbt08
Tell Me all Your Music Problems,3,"Hello everyone, So I am doing a project for my Music Products class where I have to identify a problem in the music products or services industry and solve it. What are the things that irk you about playing, listening to or writing music. I want you to bring out your dark side and tell me what you absolutely hate about everything concerning music. And maybe, just maybe, I'll solve it for you!",fczzfk
Wrong place,2,"Well, sorry if that post is long. I got nobody to talk about this and I don't speak english well so I'll try my best since I'm belgian.

Everything begun when I was 4 years old, my dad work in the navy and was often at the other side of the world for his job. My mother work in a restaurant company that have a lot of restaurant in my country so we didn't had a lack of money to live, my sister and I had a lot of present every weeks so we played a lot together. I loved my sister a lot as her big brother and I even learned her to walk (she's two years younger than me).
But everything wasn't always pink, my sister and I are different from other people since we've the Asperger's syndrome (a form of autism). That make that we've a lot of difficulty to understand the other humans and can learn very fast when we want to, our dad has the same thing than us and he knew that we were like him when we were young. So he bring us by people who are specialised with child like us to know how to manage us but our mother weren't okay with that because she wanted that we had a ""normal"" and happy life. My sister and I were diagnosed with the Asperger's syndrome and so we passed some test to know at wich point it was.

Me at 4 years old I had an IQ of 130, my sister at 2 years old 140. She already could speak and do math and had a complete photographic memory. 

Our parents discussed about these results, our dad was very happy and wanted to put us in an specialised school but our mother was a bit horryfied at the tought that we would only study without experimenting a normal life. So our dad put my sister and I in an school with other child of our age but with an experimental program that learned us an foreign language very young. At the age of 5 we had a test to enter the next phase of the program and my father sing me in without my mother knowing it. 

When they got the letter saying that I wasn't accepted because of my hyperactivity even if I had the best scotes my dad phoned to the director of the program and said that the exam wasn't staying an hour on a chair but it was answering questions in different topics in an foreign language. After a few minuts discussing I was accepted. My mother couldn't stand that our dad was putting us in an experimental program like laboratory mices so they divorced but my sister and I entered the program.

I entered in elementary school, all my lessons were in Dutch except the French lesson. The other child in my class were all ""normal"", they weren't ""special"" like me so they learned slowly compared to me and when you're so young you're an alien for the others. 
If you wanted something you had to ask it in dutch even if we hadn't learned the vocabulary yet and the program was tough so we had pretty none vocabulary the first 3 years. And it so that an accident that began the real nightmare happened. I needed to go to toilet but i forgot how to say it, I was 6 years old, hypercative so I wasn't listening a lot in class and the teacher was very strict with me because she knew how I was.
Two hours later, i remembered how to say it. I stood up and walked to the teacher but in the middle of the class it was too much and I pee on myself. Everybody was laughing about me and saying that the alien leaked in the middle of the class. The next day the whole school knew it and at the midtime pause during the lunch some people 5 years above me made me dink pee making me believe that it was apple juice.
It was so that I started being bullied because I'm ""different"". In the beginning I tought that it was only little jokes that was normal between peoples (I knew nothing about social and it was really hard to me to understand, even now I'll turn 20 this summer and I have struggles to communicate).
I lived one week with my mother and the other week with my father, they hated each other and my sister and I, we needed to handle it (insults, manipulation,...). My sister weren't aware of what it was because I protected her as much as possible. She was my little world of purity and cuteness. Always smiling, fragile and pure. A lovely little sister with blue/grey eyes and blond hairs. 
Since she was victim of a rape... I failed.. I couldn't protect her, my dad was on a boat far away and my mother weren't home.. 
Since this day she lost her smile a bit more everyday, her eyes became like mine, completely grey and her hairs became more brown.
She isolated her, played less and less with me. Keeping the secret of her rape during years.
Since that happen I became more and more aware of the world around me, how people (even adults) treated me like an alien or a genius. I learned that well when I had an accident and needed a surgery that was 8 hours long or I couldn't walk anymore. Gracefully this accident also happened when my dad was in mission so the army paid the best surgeons to opperate me  because they were responsible for my security when my dad was in mission.
The years passed and the situation got worse. My dad and mother became alcoholic because my sister talked about her rape. My dad couldn't find a stable relationship and so living with him became like managing a child when you're 8.
I got bullied from my 6 years old to my 15 years old. I couldn't get out of the experimental program since I was too precious with my results so I was forced to stay with my bullyers until the end of my scholarship.
I became depressed at 9, went to the psychologist for 4 years but nothing worked and I made 2 psychologist depressed so nobody wanted to listen to me since I was a ""special case of young child with the maturity of an old man"". Some people even said of me that it was like I made the world war when I talked. 

My dad said me horrible things, that I was responsible of all his problems. That my behavior bringed all the problems that destroyed him. My mother was more gentle with me and managed everything so that I could have a better life, enjoying a bit my child life. For that I'm going to thank her forever.
But that didn't last long.
When I was 10 my dad met a women that had 4 girls. I lived a constant nightmare during 5 years. It was so hard to live that I tried twice to kill myself bit the both times I stopped right before I died because I tought that I must stay alive for my mom and my sister. I forced my sister to live exclusively by my mom and managed to make a trial against my father to live by my mom except for 2 weekends a month and the half of the holydays. 
Between my 15 and 18th anniversary a lot of things happened. Since I lost my virginity when I was 12 a lot of my """"""""""friends"""""""""" asked my help to have girlfriends or how to begin a sexual life without too much problems and how to handle it. I became to get integrate in the class and made my first real friendly relationships (at least I tought) so I learned psychology and how to handle friends. 
I begun to teach lessons after the school in an class near the study room of the school during 2 years, I helped as much as possible everyone who didn't understood something and I even went to some of them's houses around 10PM the days before exams to help them. I managed this, I listenned to their problems sometimes late in the night and helped them to solve it, I litteraly carried 20 lifes that were for me nothing but simple compared to mine and one day I fell on the ground after my day at school. I went back home, said ""Hi mom! How was your day?"" (I didn't saw her a llt because at this moment she worked 60 hours a week because we were 4 to live in the house and life became extremely expensive) and I fell appart. I made a burn-out when I was 16 years old. I stopped teaching in the classroom after the school and helped only one girl with teaching because I knew that without me she wouldn't pass her exams. (Actually she's studying to become social worker because I inspired her.)
After this my depression got worse and worse because my mother didn't stand under the pressure of her work and became more and more alcoholic.
My father's mind fell apart so I went back by him to help him. I graduated from the experimental program and my mother met her first love back. We moved out (I moved out at least 8 times during my life actually) by his house and I tried university in biology...

I think that life want me to suffer because I fell in love with a girl that was perfect, she listenned to my and the story of my life, I listenned to her and we got in couple. In december 2018 my grandfather had an cerebrovascular accident right before christmas and my exams in january. I move by my father because he lived closer to the University and so I could sleep more than 4 hours per night. Even tough i studied as I could but don't passed any exams. 3 month later my girlfriend lost two of her grand parents and by my side my father tried to kill himself, I arrived in time to stop him and he went to the hospital. I lived alone in a big house for 2 month, it was hard with the pressure of the university, my girlfriend depressed with the lost of their grand parents and my father in the hospital after an attempt to kill himself. The result: I said something horrible without noticing it directly and didn't erase the message at time (on messenger) so she broke with me right before the exams in july... I passed 2 exams on the 9. I was close for some of them with 9.8/20 but I was too tired.. Exhausted of this life and I said fuck off to the university. I had nobody to help me, I was and am alone since I'm born. Without anybody to try to understand me. I'm now learning in computing and programming since I think like a computer. A couple of days ago I lost my grandfather, he finally died after 2 years of dying slowly in the hospital. Everytimes saying to me that he suffer. My dad is always alcoholic, my mom have a better life since I left her home so I don't want to bother her with my problems (I already tried and it was catastrophic). My best-friend has his problems and I can't ask him help. My sister is rebuilding herself slightly. And me I'm carrying my whole family even if I'm completely broken in pieces. I can't cry anymore even if I want or need it. A lot of things have the taste of blood, my vision often goes dark and nothing brings me fun. I'm bored constantly. 

Here I resumed my life, I didn't tell everything. It would take a lot of time. Too much time.

If you read this thank you, it already helped me a bit. At least I hope it because I'm so stressed and depressed that I lost sleep years ago. 

This world sucks, I've been born in the wrong time or in the wrong world. I don't enjoy anything anymore and sometimes I get lost in my dreams of another world where I can finally feel peace in my heart and mind. That's the last thing that make me cry.. 
A plain, with the sun, a wind as soft as a cloud and just ths sound of the delicate wind...",fcnxf0
I really really really miss my grand-grandma,6,"I know this is not a real problem, but I still miss her to this this day. She passed on my birthday last year. She was a real fighter and always confronted life arms wide open. I would give one year of my life just to spend a single day again with her. I love you Grandma, and I miss you.",fcmc5a
Wrong body & gender,4,"(Sorry for the grammar, I'm not from a english-speaking country)

So for the past 2 years I have felt kinda... misplaced? I'm a girl that wish and think I should'eve been born as a boy. 
I've thought about being trans, but I do not think that is going to help or anything like that... I don't think it's wrong to be transgender or anything like that, I just don't feel like that is 'me', and that it's not going to work for me, if you get it.

When I think about my sexuality as a girl it's really confusing and I really don't think I have one, but when I think about what my sexuality whould'eve been if I were a boy I am 99% sure i'd be gay.
I have anxeiety and stuff like that, and when I think about this my anxeiety comes and it's just really frustrating.


I am just really confused and stuff right now and I wrote this here to get my thoughts out. If there is someone that's kinda like me, please help!",fcan69
My Experiences When Shopping,3,"I hope I found the right thread :/

I would just like to say I'm capable of going shopping by myself. When ever I go to jbhifi the person who I often spoke to wasn't too rude. Some employees are straight up rude and unhelpful, but it was the fact that they seemed to know me and when ever I go to tweed city jbhifi they always give me a stare and act like I'm a f$cking criminal. Not to long ago when I went to jbhifi to grab something... can't remember what it was, one of the dudes there asked where my parents were. Like wtf, C$$t I'm 17 nearly 18 I don't need a parent by my side to do basic shopping, like where's your friendly employee attitude. This happens all the time with other things like not giving a clear explanation on a particular product and such... keep in mind I'm friendly to them always. In fact I don't go shopping really at all. The only time I go shopping is when I wanna get myself something legendary, or rarely go with my mum or dad or just with mates.
I don't hate going out but when someone takes control of me to do basic necessities it really pisses me off. Some stores have this problem but I'll keep it short.",fc8kvh
Why is it like this,3,So I can go places and there are always people together yet I am alone. Is it because I am different or do I close myself off for se reason that can’t be explained by my own rational conscienceness.,fc3vxq
"Help, my teeth hurt!!",1,"So, I woke up in the morning, having a smoked sausage and eggs, I ate some pineapple and it was cold, so my teeth began to hurt and I was about to scream in pain when this happened.",fbw0w6
I Had a fight with my dad,4,"Let me lay it out for you all. I am 24 still living at home with my parents still looking for work. Been on and off jobs for the last year not in a financial position to move out yet. Want to be a full time writer and been doing well to build up a following, been working on my craft and decided to go to uni, starting this year. 
Considering i pay rent agreed between my father and I, and pay for my own rego, insurance, clothes, things i want or need, the only thing my rent contributes is food, electricity and water. I help around the house, do what needs to be done and apply for jobs still. He believes he can dictate what i can and can't do because i am in his words living under his roof and his word is always law. I believe that no longer applies to modern times. It is my house just as it is my siblings, my mums and his.
My dad, he's a boomer, doesn't believe you have to apply online, goes with '""call them up or walk in to speak with manager or call after the interview and do a follow up."" Thinks I have to be out of the house, believes that i should no longer be here cause of my age. I am in his eyes a financial burden.
Now my sister, she's a full time uni student learning to be a dr. She turns 20 this year, doesn't pay rent, rego, insurance, all of that is covered by dad as he agreed to do so and stated he would have done the same if i went into uni straight from highschool. My parents run a business and my sister works the small hrs she is given and hold tight onto that money. Spending it more on her GF than anything. 
All of this is frustrating as dad doesn't approve with my choice to be a writer. He doesn't approve of the course i had chosen, he's not supportive of anything i do, and throws back in my face that he helped me get jobs and how i should be thanking him and blaming me for cocking it up. I gave them my best, many admired that i got up everyday and go to work despite the bullying that went on and still he deemed as ""she could have done better.""
The argument: I clapped back at my dad, trying to lecture me on how to be an adult, how i should work like him because he chose to buy a business and do shit for it, he hates that i have free time and tries to offload more things onto me when there is no need. I have three younger siblings who do less than me. Says he's the only one with a job yet my mum runs the business from home. Stated my sister doesn't pay rent i and i do, as well with rego and insurance and she doesnt pay a cent. Telling me i should get a job, yet i have been applying for months, tell me to move out and so i throw back why i should, putting my foot down telling him he does not dictate my life or my sisters lives and that i do what needs to be done in the house, pay for rent and help when its needed, therefore he shouldn't have a say about anything i do.
In the end he says I'm going to get a rude shock and found out later he plans to make me pay for a sixth of everything. I'm not going to let it happen.
I am sorry for the long post but i wanted to tell someone. Its the first time where i have stood up for myself as my father has been controlling of me for a very long time.",fblmhv
I haven't got any new message from my best friend.. What can I do?,3,Last night I was texting my best friend on messenger and she didn't answer me at all and I got very sad about this and I was crying. Since in 2017 I've been there with her at bridge school.,fb762z
