title,score,body,id
Android idea,0,"Like ios app ""reminders"" where your todos disappear after you tap them

Well I guess can't tap everywhere but  you tap the circle icon the left of todo for that

",rc5h1v
Deep learning Dating app to Match with your perfect face,0,Dating app that When you register allow you to choose out of 20 people the one you like on appearance and then suggest you only people that look alike and also you can swipe right and ML model will constantly learn based on it! And will match you only with those who’s face features are 80-90% match with your preferences! It can also match you automatically if you and your matched human being both have ideal face for each other (based on ML model). Who needs personality anyway?? I’m sure this app already exists if yes then please share it if no then what do you think about it?,rc369n
A way to make android gaming controls more usable and similar to console.,0,"Is there a way to use the movement of your device to trigger onscreen buttons? Let's say you are playing an emulator and the original console controls required the use of 4 different inputs at once. Two thumbs and then a finger on each trigger. Many games use controls like this, and it's why playing shooters on the phone feels so clunky. When using on screen controls you can only use your two thumbs thus making it uncomfortable to properly play. For example take Minecraft. You look and move around with the joysticks, then attack or place blocks with the triggers, enabling you to simulataniously move whilst interacting. This is a critical factor in immersiveness and general playability of the gaming experience. When your control inputs are limited as they are on touchscreen devices, it forces games to adapt and change, often making console ports hard to enjoy, however creating an interesting variety of unique controls for other games that perhaps were originally designed around this flaw.

Specifically targeting emulators and console ports; games not designed around this flaw in controls, in my opinion this side of things could really do with a way of getting around this problem as it would vastly improve the enjoyability of playing (proper) games on the phone. My solution involves using the accelerometer & gyroscope to detect when the phone was being tapped on the top corners or back, and then mapping these input signals to control a touch button on the display, thus creating artificial trigger buttons for your emulator's.

You would simply hold the phone in a landscape position in a similar way to how you would hold a regular gaming controller, with your fingers resting on the top left and right corners of the screen. Just give them a good tap and that's your button. Surely the phones sensors are sensitive enough for that to be enough to trigger an onscreen reaction. Granted, this would not be a perfect solution as it would only really allow you to tap the triggers and not hold them down, however this could surely be somewhat mitigated by using a combination of all of your phones sensors to detect a purposeful input. The microphone would be able to detect a sound transient upon contact, as well as your gyroscope detecting subtle movements in orientation. Perhaps an extremely subtle flick of the phone toward whichever trigger you wish to press, in conjunction with the tap detected by the microphone, would be the best way to grant this method consistentcy as well as true functionality, via the added support of several sensors working together to detect intentional input.

Would this work, and is it already simple and easy to do with apps currently available?",rbs5ja
LFT - crypto token idea,0,"Instead of having a single token like [NFT](https://en.m.wikipedia.org/wiki/Non-fungible_token), it has limited number of token which represents the same entity (digital art or music) and it works more like a shares in the stock market.",rbh3h8
Constitutes: Review Platform for Governments and Corporations,0,"This could be like Yelp or Urban Dictionary, maybe even an efficient way for citizens to contact Congress or local municipalities. Provide a space for people to make suggestions on policies they’d like to see proposed, or share concerns regarding privacy policies and maybe, hopefully, fingers crossed… maybe just maybe, get some policy put in place to protect our privacy and data.",rbeq79
An app that sends texts to someone on their birthday,0,"The app connects to your contacts. You put someone's name on a calendar where their birthday is, and write whatever message you'd like them to be sent on their birthday. Then the app sends them that message on their birthday. This way you'll never forget.",rbdkmm
Looking to develop a team focused exercise tracker.,1,"My friends and I get involved in various exercise related charity challenges and enjoy them but then the challenge ends and we lose access to the charities cool exercise tracker and we all go back to doing nothing. I've tried to find a suitable tracker out their but haven't been happy with them so I'm looking to make (or have made) some kind of team exercise tracker.

I have a little survey that will take up to 15 minutes to find out what people want in this space. If it sounds like something you're interested in or might have ideas on could you please complete this basic survey? There are no rewards for doing the survey other than you get some say in how it will be built and you can opt in to hear when it is developed. Also open to any suggestions as comments to this post instead.

[https://docs.google.com/forms/d/e/1FAIpQLSdH7W6zfmttOCQIhb6\_M8Ov0yzdV-jpUNRCP4dVJsD5T2Nffw/viewform?usp=sf\_link](https://docs.google.com/forms/d/e/1FAIpQLSdH7W6zfmttOCQIhb6_M8Ov0yzdV-jpUNRCP4dVJsD5T2Nffw/viewform?usp=sf_link)",rbcgud
How to Develop an app for online grocery shopping like elGrocer?,0,,raw7nm
Music responding to your efficiency,0,,rauwj2
Code Converter,0,"What do you think of this idea. A web app that converts say, Python code to C, so that you can code in Python, but have it be as fast as C",rakwme
Gaming Fitness App,2,"Hello AppIdeas, I wanted to make a fitness app where users could create their own challenges (workouts) and post them so others can take on the challenge. There will be rewards for accepting and posting challenges. If there are no posted challenges users can do Daily challenges always available. There are other things I would like to add but that's the basic concept. Friendly challenges can motivate a person to workout is the hope. Any thoughts would be appreciated!  Thanks in advance!",rajfqs
An App that let's you trade subscription services login credentials,0," if I have a Netflix account and looking for an Amazon Prime account,  I get matched up with someone who's looking for Netflix and has Amazon Prime account. Not sure if it's legal.",rahshe
"Leaderboard app for runners, dating app for math lovers & more ideas for solopreneurs",2,,radlpj
The group chat paradox 📉,1,"When I joins the group chat after the long conversation, They have discussed more than one topic in the same chat channel so I could not able to follow what they have chated. I need to read the whole conversation to understand what they have discussed.

• Do you encounted this problem in your group chats?
• Do you have any solution to this problem?",r9zy0q
Not just any other dating app..,0,"💡Got another app idea, not sure if it’s a thing or not:

A dating app where people leave reviews of you after having dated you (probably should only keep the most recent 3 years or something). Potential prospects could pay more for x-rated details like good/bad in bed (with a summary or detailed passage explanation). You get to rate with stars and you’ll have a rank of 1-5 stars as well as a recommend/wouldn’t recommend dating. Reviews would be kept anonymous. The details would be up to the individual as that’s your choice what you’re willing to share as it could potentially expose who you are.



It would at least be VERY entertaining so you know folks would sign up for the tea ☕️

Don’t ask me for design ideas. Take it and run with it. If it’s a million dollar idea throw me some change 😉",r9sjyn
Hyperlocal social media networking app 2022,0,,r8opj6
An app that tells you when an NSFW scene is coming up in a movie.,16,"Here me out right, you in a theater watching a P13 or R rated movie with your parents and BOOM a big 45 and half second, full on nude, rough sex scene with loud moaning comes on and catches you off guard.

What now, you have to sit there, awkward as hell, with a possible boner and wait it out while your parents are right next to you and your dad bumps you on the shoulder saying ""you like it, don't you 😏"" OK maybe not the last part haha. But still.

This app would be the ultimate life saver called ""NSFW Saver""

So you click on the movie, time you are watching it and the app will vibrate in a certain pattern to distinguish it from a regular notification. That will let you know what's good what's good, you should leave to the bathroom now or where you want to go. Then the app will vibrate when that scene is over, so you can go back to your seat.

Yes there may be more then one NSFW scene. So your parents may question

""Why you're going to the bathroom so many times during the movie?""

""Uh... I'm very gassy.""

Or

""You seem to have left the theater at the exact times that a sex scene was going to happen....""

""I don't know.... uh coincidence I guess.""",r8fzf8
Need a very specific app for ordering food through the front desk of a business,2,"No idea if anyone has any leads, but my work has asked me to find a very specific app.

We have clients in different rooms within our business and we want an app where they can order food through the front desk. Only through a curated menu of restaurants that we have selected to appear on the app. For example, the front desk gets a ping that room 5 wants X from chipotle. Then the front desk orders it for them. I know there is uber eats and deliveroo but the company wants to make the front desk the middle man.",r8cdez
Develop Car Rental App like Turo: A peer-to-peer Car Sharing Platform,0,,r7vrh7
"App that allows gift receiver to select the colour, size or any attributes that a gift may have",3,"Pretty much the title. A simple app that notifies the gift receiver that a gift has been purchased in his/her name. If they would like, they can select the size(if clothes), colour (if relevant) or any other attributes the gift may have.

Edit: The receiver will not be able to reject/deny/cancel the gift. The anonymity of the sender and the gift itself (including the price) can be maintained by disclosing very little information or only asking what is requested by the sender. 

",rf9e46
App that shows how other people would say something:,2,"Almost constantly we hear people respond with boring phrases such as “that’s so cool”, “wow- really” and “not much, you?”. The truth is, this type of dialog is boring and adds nearly nothing to a convo. Most people, even if they’re interested in the conversation, can lack the creativity to say a tailor made reply. 

     That is where this app would help change that. A vocabulary of words is no good if they can’t be arranged into a vocabulary of phrases. People will often lack a reply and resort to something they say frequently, then ask themselves: “How else could I have said that?” 

     This has the potential be a very good network app- if designed correctly. My vision would be a simplistic and minimalist “Reddit” style chat room, where a phrase or question can be posted between quotations. Other users can then post on the phrase how they would say the phrase in they’re own words. 

     Posting responses will give a string of comments in order of the best user rated synonymous phrase. Any question, phrase or one-liner could be posted, helping people improve their vocabulary of things to say daily during conversation.",rf53e7
Request: iOS app that allows you to use iPhone or iPad as Sony Camera monitor through lightning cable,1,"We invest a lot of money in our Sony cameras at all professional tiers, from the under $1,000 mirror less cameras to the big sensor cinema cameras. We also invest a lot of money into our phones and tablets. Then, we spend more to purchase monitors (the ones that attach to your camera, not your computer) that we can use in various ways with our cameras.

The hardware in our iPhones and iPads are more than enough to handle anything a professional monitor could do and even has editing apps that have a lot of the simple editing features that simple videos that only need, like Adobe rush or even iMovie. 

In addition, the ability to use the iOS device as an SSD would be amazing too, as it would cut down on a lot of extra steps in workflow and create instant iCloud update. But with all that, the monitor part seems like something that should already exist.

Sony’s imaging edge app is insanely horrible with my a6400 and is missing some of the features that only exist on the camera’s touchscreen for some reason that many of you could definitely explain better than me. I believe this could be because of the camera’s limitations and the fact that it’s through Wi-Fi rather than wired.

Is this possible?",re8fhk
APP IDEA,0,the idea for the app/platform would be in the form of a map where you can share and connect with people who have been to that location or are planning to go to that location for example “Cancun”  pin / post pictures of your time/experience in Cancun other people can add  to it or comment new way to explore  somewhere new - Say for example your in I don’t know Miami  or Cancun and someone is planning to go there but have never been or know where to go etc etc people can view interact and comment on your pictures to get a feel for the city - Experience new things or things you normally wouldn’t do,re5nxy
Mental assaciation app,0,"One of the best techniques for learning a large amount of information is to associate words or create mnemonic devices to retain information. So why not create an app that when you feed it with the courses or the information you want to learn, it can generate an image that is easy to remember using an AI?  Visual and mental associations can help the average brain retain large degrees of information. Visualisation is a muscle. It can be grown and strengthened, stretched and flexed. The reality is that we can teach our brains how to see more clearly and then we can teach them how to show ",re13o6
Unionization as a service,7,"Provide easier routes to start a union, possible features might include:

\- Easy access to organizers who can reach out to other employees within the company and begin organizing without the initiator worrying about retribution (or dealing with work politics)

\- Anonymous (but still verified) chat groups where employees can organize without worrying about screenshots and identities being leaked to management

\- Report, document, and publish union busting tactics

\- Election petition filing

\- Fundraising

\- Connect organizers with marketing resources for larger campaigns

EDIT additional why:

Now that we live in such a politically polarized environment it's extremely taboo to bring up subjects that relate to politics or political identity. This has a paralyzing effect on the ability of employees to organize together and represent themselves. What are the current viable options for organizing? Walking around your office and asking everyone how they feel about unions? Sure, you could also send friend requests on Facebook to every single one of your coworkers but that has far worse consequences than simply being fired, plus you lose all anonymity. 

Organizing is really difficult and not often a skill possessed by those working generally in the labor market, nobody should be left out of the benefits of unionization because they lack people skills, charisma, or social standing. By reducing the risk for employees involved the service should give meaningful access to one of our most valuable rights.",rduoge
Taskified - Gamified Tasks,8,"I was thinking about developing an app with gamification elements for a long time.
couple pf days ago i encountered a problem with my son who didn't want to do some chores and thought about this idea:

a parent - child app where parents can post tasks, each completed task rewards the child who finished it with points, those points can be converted to rewards that parent posted also.

some user stories i thought about:
parent side:
 can assign task to all of his children or an individual.
 can add gifts / rewards to be redeemed with points
 can track task / child proccess
 can assign a deadline for a task


child side:
 can take a task disabling it to other children
 can redeem points to gifts / rewards
 can earn predetermined amount of pts for each day (or maybe day streaks or something)
 earns badges / unlock achievements / leveling up


 this educational method is a common method from the Cognitive Behavioral Therapy (CBT)",rdhl9a
App Idea for managing your Boat Cruising logistics with your friends - thoughts,5,"As a solo boat owner, I end up doing a lot of work on google spreadsheets etc managing logistics for when I go out with my friends and join other friends as we boat around, fuel, food, spoilage, I end up throwing out a-lot of food that has gone bad because I store if improperly etc.  What if I could manage this all in a simple app and share trip management with friends



thanks (p.s. I am not a one percenter :) I am tring to keep my costs down and do a sport I love but more efficiently



thanks!",rd8yly
